{
  "id": 12345,
  "ticker": "AAPL",
  "strategy": "vcp",
  "as_of_date": "2026-03-28T00:00:00Z",
  "score": 0.82,
  "details": {"breakout_price": 172.34, "volume_confirmed": true},
  "tags": ["vcp-breakout", "volume-confirmed"],
  "created_at": "2026-03-28T12:34:56Z",
  "created_by_job_run_id": "2f1e6b10-3c4a-4d2a-9f5b-3a8b9d6c7e1f"
}
